	id	output	mode	rating
0	344362658.58046.58022	the bot seems to be down again . maybe can you give it a nudge for me ?	ilp	3
247	AYG-A1F-56	the same user ( 74 . 140 . 207 . 84 ) keeps vandalizing the page over and over . could we have a semilocked page for you ?	greedy	5
229	A3S-AYG-84	no problem . mav , could you give your opinion on talk : republic of ireland please ? 18 : 55 nov 17 , 2002 ( utc )	greedy	4
97	536836485.896.5888	so it was just the final fantasy mos - p <unk>	greedy	3
139	388522044.71835.71835	also , i noticed that you nominated [ bingolotto ( norway ) separately . can you and like to make this a double hook ?	retrieval	2
274	A2U-A1F-2	then can you make some contributions in some of your many areas of expertise ?	retrieval	5
124	745256200.16421.16421	how did you delete that about 2 minutes after i added that ? he did this to me too	retrieval	5
190	AYG-A1F-54	yes , may u unprotect this page s . jithesh and allow to recreate the article with more references and sources . . . ? |	ilp	3
216	AYG-A2U-45	no problem , then will you make some contributions in some of your many areas of expertise ?	greedy	4
273	A3S-A1F-37	could you provide for me permission was received to copy these article from the respective websites and ?	retrieval	2
63	76828126.8874.8874	- often the case in ku club on a weekendwhat did this actually mean ? in anycase removed it .	greedy	2
157	AYG-A2U-17	no problem . hey can you check one more photo for me < unk > > : image : cesar franck . jpg ?	ilp	4
20	76125056.2.18241	btw , will you complete it ? i need diff times around , etc . thanks ,	ilp	5
127	187172385.44467.74287	hello la2 , will you just check the accuracy of this edit ? thanks . -	retrieval	5
158	AYG-A1F-45	deleting stuff on the talk page ? ok , not done sir . everyone look at history of page for sockpuppetry proofs .	ilp	5
6	231234751.219.7499	and what ? there ' s no mention of it on the ada page , and surely there isn ' t sources about it . . . . . unsigned	ilp	5
167	A23-A1F-6	btw could you do montage pics for montreal and toronto article ? thank you and god bless you .	ilp	5
26	495773626.1112.1094	so why is this linked to the pla ' s vehicles section ? please surely	ilp	3
45	398481738.1386.1371	i added one sentence about her construction and design . what else would you suggest ?	ilp	5
212	A1F-A3S-98	no problem . can all interested editors discuss the reintroduction of images to the article ?	greedy	5
145	398481738.1386.1371	i added one sentence about her construction and design . what else would you suggest ?	retrieval	5
10	173647831.52650.0	btw anyone in singpoore , will you explain a little bit more about the characteristics of this program ? . thank you .	ilp	5
71	335373641.13951.0	hi , can you explain why you deleted the ruon page ? thanks	greedy	5
266	AYG-A2U-45	then can you make some contributions in some of your many areas of expertise ?	retrieval	5
146	31346104.1416.1416	can you take it upon yourself to add names to the category to keep it in sync ? cheers	retrieval	5
160	A23-A2U-78	btw , why the hell not use a redirect ? ok , should have checked before commenting , sorry	ilp	5
60	173647831.52650.0	anyone in singpoore , can you please explain a little bit more about the characteristics of this program ? . thank you .	greedy	5
177	AYG-A1F-55	yes , could we have a synonym for ' ' careen ' ' that non - americans will understand , ? like ' ' lurch ' ' ?	ilp	4
277	AYG-A1F-55	sorry , could we have a synonym for ' ' careen ' ' that non - americans will understand , ? like ' ' lurch ' ' ?	retrieval	4
112	420450406.899.27455	looks like signup closed again ? looks useful . • blp - r	retrieval	5
159	AYG-A2U-91	btw , matty , could you just protect victor moses . . . another link to liverpool causing vandalism . sorry , john	ilp	2
74	745256200.16421.16421	how did you delete that about 2 minutes after i added that ? he actually did this to me too	greedy	5
195	A23-A3S-58	hi , sorry , no , it is not a bug that you can edit anything . do your tests in the wikipedia : sandbox .	ilp	2
121	335373641.13951.0	can you explain why you deleted the ruon page ? thanks	retrieval	5
284	A23-A1F-43	could you remove my edit   from the visible page history for privacy reasons ?	retrieval	5
91	119658625.0.0	could someone confirm for you and state that dar ul - funum was ( is ? ) in teheran . fritz @ joern . de	greedy	1
24	745256200.16421.16421	how did you delete that about 2 minutes after i added that ? and he really did this to me too	ilp	5
255	A2U-A1F-45	can you take a look   please , and add anything you feel appropriate . thanks . '	retrieval	5
7	705404990.59113.59113	no worries . sorry , can you review this or block or have it reviewed for me at ani ?	ilp	3
62	420450406.899.27455	looks like signup closed again ? looks really useful . • blp - r	greedy	4
131	609578515.1666.1063	it has not generated the book reports for a long time . can you check ? — · [   ]	retrieval	5
85	816872259.676.28437	actually again , what are you talking about and what are you banning me for ? diffs .	greedy	5
299	A2U-A1F-97	can someone please add a list of presenters to the article ?	retrieval	5
226	A23-A2U-3	oh , did i revert you by accident ? i ' ll fix that right away . please	greedy	4
204	A1F-A23-34	hi joan , per your closing comment , userfy the article for me ? thanks .	greedy	1
144	788800516.3850.0	can someone explain why there 's a coi tag on this article ? it 's not evident from the talk page .	retrieval	5
176	A23-A2U-3	oh damn btw did i revert you by accident ? i ' ll fix that right away please .	ilp	4
106	231234751.219.7499	what ? there 's no mention of it on the ada page , and there s no sources about it ... unsigned ]	retrieval	4
275	A23-AYG-35	lareve , can you say on talk : julius tomin what your objection is to this material ?	retrieval	2
22	156935122.798.0	and what is a graham cracker ? ? please ( 16 january 2007 )	ilp	3
81	609578515.1666.1063	it has not generated the book reports for a long time . can you check for you ? <unk>· [ ]	greedy	2
57	705404990.59113.59113	can you review this or block for you or have it reviewed at ani ? thank you	greedy	3
269	A23-A3S-76	no problem . sodacan , would you mind vectorizing the images below ? it would be great .	retrieval	5
100	344362658.58046.58022	the bot seems to be down again . thank you . can you give it a nudge ?	retrieval	4
207	AYG-A2U-17	no problem . btw , check one more photo for me < unk > : image : cesar franck . jpg ?	greedy	5
118	27309085.35258.35250	jdavidb , if you have a chance would you mind taking a look at this : wp : an / 3rr # user : fuelwagon . thanks .	retrieval	5
194	A23-A3S-91	hi ! hi ! hi ! hi !	ilp	5
294	A23-A3S-91	um , i ' m so sorry i did not notice that i removed that notice .	retrieval	5
12	420450406.899.27455	looks like signup really closed again ? looks useful . please • blp - r	ilp	5
143	796956571.0.81137	thank you . can you provide me with any evidence ? i ' ve had this suspicion for a while now .	retrieval	5
117	468934575.1618.42708	hi 68 ... who are you ? , ,   ... or all of the above ? or   ?	retrieval	2
184	A23-A1F-43	hi , sorry , could you remove my edit from the visible page history for privacy reasons ? ok , thanks for reading this .	ilp	5
150	A23-A1F-7	by the way , could you give me the link of the rfc for you . i fear i just missed it !	ilp	3
154	A1F-A23-34	joan , per your closing comment , please userfy the article for you ?	ilp	2
113	76828126.8874.8874	- often the case in ku club on a weekendwhat did this mean ? or in anycase removed it .	retrieval	1
156	A23-A3S-20	no problem . also , i noticed that you nominated [ bingolotto ( norway ) separately . btw , would you like to make this a double hook ?	ilp	3
235	A23-A2U-13	i write in spanish . you can see the fritjof capra book the weft of live .	greedy	2
75	616521646.0.0	aren ' t you idiots for deleting faydee ? isn ' t on every disco club all over the world with " can ' t let go " .	greedy	1
292	A23-A1F-89	but  i see you might not really fit in well . d	retrieval	4
169	A23-A3S-76	sodacan , would you mind vectorizing the images below ? it would be great for you . thanks .	ilp	5
210	A23-A2U-78	yes , why not use a redirect ? please should have checked before commenting ,	greedy	5
59	846513598.15186.13399	can you please stop your whining , and think about solutions instead ? tx .	greedy	5
186	A2U-A3S-46	by the way , would it be for you to consider reviewing my gan of " cliche ( hush hush ) ( song ) " ? best ,	ilp	3
188	A1F-A2U-18	hey guys , can you just read wikipedia for you : signatures # transclusion of templates ?	ilp	1
76	495773626.1112.1094	why is this linked to the pla ' s vehicles section ? surely	greedy	2
221	A1F-AYG-48	are you aware of the above wikiproject ? and if so , are you a member ? if not , join !	greedy	5
256	A23-A3S-20	also , i noticed that you nominated [ [ bingolotto ( norway ) separately . would you like to make this a double hook ?	retrieval	2
72	156935122.798.0	what is a graham cracker ? ? ( 16 january 2007 )	greedy	5
209	AYG-A2U-91	no problem . matty , can you protect victor moses for you . . another link to liverpool causing vandalism . john	greedy	2
276	A23-A2U-3	oh , did i revert you by accident ? and i ' ll fix that right away .	retrieval	5
73	616642348.18079.18061	hi surtsicna , will you be willing to sign up to wp : wikiproject channel islands ? thanks , .	greedy	4
250	A23-A1F-7	sorry , could you give me the link of the rfc . i fear i have missed it !	retrieval	5
232	A3S-A23-23	lehrkind mansionsee . if this pans out , can you snap a free photo for us ?	greedy	5
224	A2U-A1F-2	hello , then will you make some contributions in some of your many areas of expertise ? btw	greedy	4
163	A1F-AYG-51	please , can someone explain why there ' s just a coi tag on this article ? it ' s not really obvious from the talk page .	ilp	5
281	AYG-A2U-99	could you make an account on test you your steward access can be set . thank you .	retrieval	1
18	27309085.35258.35250	jdavidb , if you have a chance would you mind taking a look at this : wp : an / 3rr # user : fuelwagons . thanks .	ilp	5
17	468934575.1618.42708	68 . . . who are you ? , . . . or all of the above ? or perhaps ?	ilp	3